{"componentChunkName":"component---src-components-page-templates-info-page-tsx","path":"/patterns/Forms/error-validation/","result":{"data":{"mdx":{"id":"ddde24b3-4501-57fe-bbec-75fdc13698ae","frontmatter":{"title":"Error validation","intro":null,"cmsgov":null,"core":{"figmaNodeId":"4199-1535","githubLink":"docs/content/patterns/Forms","storybookLink":"patterns-error-validation-examples--docs"},"healthcare":null,"medicare":null},"slug":"patterns/Forms/error-validation","body":"const _excluded = [\"components\"];\nfunction _extends() { _extends = Object.assign ? Object.assign.bind() : function (target) { for (var i = 1; i < arguments.length; i++) { var source = arguments[i]; for (var key in source) { if (Object.prototype.hasOwnProperty.call(source, key)) { target[key] = source[key]; } } } return target; }; return _extends.apply(this, arguments); }\nfunction _objectWithoutProperties(source, excluded) { if (source == null) return {}; var target = _objectWithoutPropertiesLoose(source, excluded); var key, i; if (Object.getOwnPropertySymbols) { var sourceSymbolKeys = Object.getOwnPropertySymbols(source); for (i = 0; i < sourceSymbolKeys.length; i++) { key = sourceSymbolKeys[i]; if (excluded.indexOf(key) >= 0) continue; if (!Object.prototype.propertyIsEnumerable.call(source, key)) continue; target[key] = source[key]; } } return target; }\nfunction _objectWithoutPropertiesLoose(source, excluded) { if (source == null) return {}; var target = {}; var sourceKeys = Object.keys(source); var key, i; for (i = 0; i < sourceKeys.length; i++) { key = sourceKeys[i]; if (excluded.indexOf(key) >= 0) continue; target[key] = source[key]; } return target; }\n/* @jsxRuntime classic */\n/* @jsx mdx */\n\nconst _frontmatter = {\n  \"title\": \"Error validation\",\n  \"core\": {\n    \"figmaNodeId\": \"4199-1535\",\n    \"githubLink\": \"docs/content/patterns/Forms\",\n    \"storybookLink\": \"patterns-error-validation-examples--docs\"\n  }\n};\nconst makeShortcode = name => function MDXDefaultShortcode(props) {\n  console.warn(\"Component \" + name + \" was not imported, exported, or provided by MDXProvider as global scope\");\n  return mdx(\"div\", props);\n};\nconst StorybookExample = makeShortcode(\"StorybookExample\");\nconst layoutProps = {\n  _frontmatter\n};\nconst MDXLayout = \"wrapper\";\nreturn function MDXContent(_ref) {\n  let {\n      components\n    } = _ref,\n    props = _objectWithoutProperties(_ref, _excluded);\n  return mdx(MDXLayout, _extends({}, layoutProps, props, {\n    components: components,\n    mdxType: \"MDXLayout\"\n  }), mdx(\"h2\", {\n    \"id\": \"anatomy-of-recommended-error-validation\",\n    \"style\": {\n      \"position\": \"relative\"\n    }\n  }, mdx(\"a\", {\n    parentName: \"h2\",\n    \"href\": \"#anatomy-of-recommended-error-validation\",\n    \"aria-label\": \"anatomy of recommended error validation permalink\",\n    \"className\": \"anchor before\"\n  }, mdx(\"svg\", {\n    parentName: \"a\",\n    \"aria-hidden\": \"true\",\n    \"focusable\": \"false\",\n    \"height\": \"16\",\n    \"version\": \"1.1\",\n    \"viewBox\": \"0 0 16 16\",\n    \"width\": \"16\"\n  }, mdx(\"path\", {\n    parentName: \"svg\",\n    \"fillRule\": \"evenodd\",\n    \"d\": \"M4 9h1v1H4c-1.5 0-3-1.69-3-3.5S2.55 3 4 3h4c1.45 0 3 1.69 3 3.5 0 1.41-.91 2.72-2 3.25V8.59c.58-.45 1-1.27 1-2.09C10 5.22 8.98 4 8 4H4c-.98 0-2 1.22-2 2.5S3 9 4 9zm9-3h-1v1h1c1 0 2 1.22 2 2.5S13.98 12 13 12H9c-.98 0-2-1.22-2-2.5 0-.83.42-1.64 1-2.09V6.25c-1.09.53-2 1.84-2 3.25C6 11.31 7.55 13 9 13h4c1.45 0 3-1.69 3-3.5S14.5 6 13 6z\"\n  }))), `Anatomy of recommended error validation`), mdx(\"p\", null, `Use the `, mdx(\"a\", {\n    parentName: \"p\",\n    \"href\": \"#validation-on-submit-default\"\n  }, `Validation on Submit`), ` pattern for most use cases. Use `, mdx(\"a\", {\n    parentName: \"p\",\n    \"href\": \"#instant-validation\"\n  }, `Instant Validation`), ` when the answers aren't obvious or when input fields are difficult to complete.`), mdx(\"img\", {\n    src: anatomyImage,\n    width: \"800\",\n    alt: \"Diagram showing anatomy of error validation in a form. Displayed are an alert with a heading and two links within, two text fields (with the last one having an error message), a date input field with an error message, and a submit button.\"\n  }), mdx(\"h3\", {\n    \"id\": \"1-summary-error-heading\",\n    \"style\": {\n      \"position\": \"relative\"\n    }\n  }, mdx(\"a\", {\n    parentName: \"h3\",\n    \"href\": \"#1-summary-error-heading\",\n    \"aria-label\": \"1 summary error heading permalink\",\n    \"className\": \"anchor before\"\n  }, mdx(\"svg\", {\n    parentName: \"a\",\n    \"aria-hidden\": \"true\",\n    \"focusable\": \"false\",\n    \"height\": \"16\",\n    \"version\": \"1.1\",\n    \"viewBox\": \"0 0 16 16\",\n    \"width\": \"16\"\n  }, mdx(\"path\", {\n    parentName: \"svg\",\n    \"fillRule\": \"evenodd\",\n    \"d\": \"M4 9h1v1H4c-1.5 0-3-1.69-3-3.5S2.55 3 4 3h4c1.45 0 3 1.69 3 3.5 0 1.41-.91 2.72-2 3.25V8.59c.58-.45 1-1.27 1-2.09C10 5.22 8.98 4 8 4H4c-.98 0-2 1.22-2 2.5S3 9 4 9zm9-3h-1v1h1c1 0 2 1.22 2 2.5S13.98 12 13 12H9c-.98 0-2-1.22-2-2.5 0-.83.42-1.64 1-2.09V6.25c-1.09.53-2 1.84-2 3.25C6 11.31 7.55 13 9 13h4c1.45 0 3-1.69 3-3.5S14.5 6 13 6z\"\n  }))), `1. Summary error heading`), mdx(\"ul\", null, mdx(\"li\", {\n    parentName: \"ul\"\n  }, `Content helps frame the information in the alert and reminds the user of what they're trying to accomplish by fixing the errors.`), mdx(\"li\", {\n    parentName: \"ul\"\n  }, `Always end in a colon because it's leading into the bulleted list of items to fix.`), mdx(\"li\", {\n    parentName: \"ul\"\n  }, `Recommended heading content is \"Complete these items to...\"`)), mdx(\"h3\", {\n    \"id\": \"2-summary-error-list\",\n    \"style\": {\n      \"position\": \"relative\"\n    }\n  }, mdx(\"a\", {\n    parentName: \"h3\",\n    \"href\": \"#2-summary-error-list\",\n    \"aria-label\": \"2 summary error list permalink\",\n    \"className\": \"anchor before\"\n  }, mdx(\"svg\", {\n    parentName: \"a\",\n    \"aria-hidden\": \"true\",\n    \"focusable\": \"false\",\n    \"height\": \"16\",\n    \"version\": \"1.1\",\n    \"viewBox\": \"0 0 16 16\",\n    \"width\": \"16\"\n  }, mdx(\"path\", {\n    parentName: \"svg\",\n    \"fillRule\": \"evenodd\",\n    \"d\": \"M4 9h1v1H4c-1.5 0-3-1.69-3-3.5S2.55 3 4 3h4c1.45 0 3 1.69 3 3.5 0 1.41-.91 2.72-2 3.25V8.59c.58-.45 1-1.27 1-2.09C10 5.22 8.98 4 8 4H4c-.98 0-2 1.22-2 2.5S3 9 4 9zm9-3h-1v1h1c1 0 2 1.22 2 2.5S13.98 12 13 12H9c-.98 0-2-1.22-2-2.5 0-.83.42-1.64 1-2.09V6.25c-1.09.53-2 1.84-2 3.25C6 11.31 7.55 13 9 13h4c1.45 0 3-1.69 3-3.5S14.5 6 13 6z\"\n  }))), `2. Summary error list`), mdx(\"h4\", {\n    \"id\": \"a-error-link\",\n    \"style\": {\n      \"position\": \"relative\"\n    }\n  }, mdx(\"a\", {\n    parentName: \"h4\",\n    \"href\": \"#a-error-link\",\n    \"aria-label\": \"a error link permalink\",\n    \"className\": \"anchor before\"\n  }, mdx(\"svg\", {\n    parentName: \"a\",\n    \"aria-hidden\": \"true\",\n    \"focusable\": \"false\",\n    \"height\": \"16\",\n    \"version\": \"1.1\",\n    \"viewBox\": \"0 0 16 16\",\n    \"width\": \"16\"\n  }, mdx(\"path\", {\n    parentName: \"svg\",\n    \"fillRule\": \"evenodd\",\n    \"d\": \"M4 9h1v1H4c-1.5 0-3-1.69-3-3.5S2.55 3 4 3h4c1.45 0 3 1.69 3 3.5 0 1.41-.91 2.72-2 3.25V8.59c.58-.45 1-1.27 1-2.09C10 5.22 8.98 4 8 4H4c-.98 0-2 1.22-2 2.5S3 9 4 9zm9-3h-1v1h1c1 0 2 1.22 2 2.5S13.98 12 13 12H9c-.98 0-2-1.22-2-2.5 0-.83.42-1.64 1-2.09V6.25c-1.09.53-2 1.84-2 3.25C6 11.31 7.55 13 9 13h4c1.45 0 3-1.69 3-3.5S14.5 6 13 6z\"\n  }))), `a. Error link`), mdx(\"ul\", null, mdx(\"li\", {\n    parentName: \"ul\"\n  }, `Include bullets for each item listed.`), mdx(\"li\", {\n    parentName: \"ul\"\n  }, `Link to corresponding input fields via an `, mdx(\"inlineCode\", {\n    parentName: \"li\"\n  }, `aria-describedby`), ` attribute on the input.`, mdx(\"ul\", {\n    parentName: \"li\"\n  }, mdx(\"li\", {\n    parentName: \"ul\"\n  }, `When a user has to enter their answer into multiple fields, such as the day, month and year fields in the date input component, link to the first field that contains an error.`), mdx(\"li\", {\n    parentName: \"ul\"\n  }, `For questions that require a user to select one or more options from a list using radios or checkboxes, link to the first radio or checkbox.`))), mdx(\"li\", {\n    parentName: \"ul\"\n  }, `Link text should match the field title.`)), mdx(\"h4\", {\n    \"id\": \"b-error-description\",\n    \"style\": {\n      \"position\": \"relative\"\n    }\n  }, mdx(\"a\", {\n    parentName: \"h4\",\n    \"href\": \"#b-error-description\",\n    \"aria-label\": \"b error description permalink\",\n    \"className\": \"anchor before\"\n  }, mdx(\"svg\", {\n    parentName: \"a\",\n    \"aria-hidden\": \"true\",\n    \"focusable\": \"false\",\n    \"height\": \"16\",\n    \"version\": \"1.1\",\n    \"viewBox\": \"0 0 16 16\",\n    \"width\": \"16\"\n  }, mdx(\"path\", {\n    parentName: \"svg\",\n    \"fillRule\": \"evenodd\",\n    \"d\": \"M4 9h1v1H4c-1.5 0-3-1.69-3-3.5S2.55 3 4 3h4c1.45 0 3 1.69 3 3.5 0 1.41-.91 2.72-2 3.25V8.59c.58-.45 1-1.27 1-2.09C10 5.22 8.98 4 8 4H4c-.98 0-2 1.22-2 2.5S3 9 4 9zm9-3h-1v1h1c1 0 2 1.22 2 2.5S13.98 12 13 12H9c-.98 0-2-1.22-2-2.5 0-.83.42-1.64 1-2.09V6.25c-1.09.53-2 1.84-2 3.25C6 11.31 7.55 13 9 13h4c1.45 0 3-1.69 3-3.5S14.5 6 13 6z\"\n  }))), `b. Error description`), mdx(\"ul\", null, mdx(\"li\", {\n    parentName: \"ul\"\n  }, `Use the same language as the inline error message.`)), mdx(\"h3\", {\n    \"id\": \"3-inline-error\",\n    \"style\": {\n      \"position\": \"relative\"\n    }\n  }, mdx(\"a\", {\n    parentName: \"h3\",\n    \"href\": \"#3-inline-error\",\n    \"aria-label\": \"3 inline error permalink\",\n    \"className\": \"anchor before\"\n  }, mdx(\"svg\", {\n    parentName: \"a\",\n    \"aria-hidden\": \"true\",\n    \"focusable\": \"false\",\n    \"height\": \"16\",\n    \"version\": \"1.1\",\n    \"viewBox\": \"0 0 16 16\",\n    \"width\": \"16\"\n  }, mdx(\"path\", {\n    parentName: \"svg\",\n    \"fillRule\": \"evenodd\",\n    \"d\": \"M4 9h1v1H4c-1.5 0-3-1.69-3-3.5S2.55 3 4 3h4c1.45 0 3 1.69 3 3.5 0 1.41-.91 2.72-2 3.25V8.59c.58-.45 1-1.27 1-2.09C10 5.22 8.98 4 8 4H4c-.98 0-2 1.22-2 2.5S3 9 4 9zm9-3h-1v1h1c1 0 2 1.22 2 2.5S13.98 12 13 12H9c-.98 0-2-1.22-2-2.5 0-.83.42-1.64 1-2.09V6.25c-1.09.53-2 1.84-2 3.25C6 11.31 7.55 13 9 13h4c1.45 0 3-1.69 3-3.5S14.5 6 13 6z\"\n  }))), `3. Inline error`), mdx(\"ul\", null, mdx(\"li\", {\n    parentName: \"ul\"\n  }, `Content used for inline error messages will also appear in the summary error description.`), mdx(\"li\", {\n    parentName: \"ul\"\n  }, `Inline error text should be outside of the label element.`), mdx(\"li\", {\n    parentName: \"ul\"\n  }, `Inline error messages should be linked to their corresponding input fields via an `, mdx(\"inlineCode\", {\n    parentName: \"li\"\n  }, `aria-describedby`), ` attribute on the input.`)), mdx(\"h3\", {\n    \"id\": \"4-active-submit-button\",\n    \"style\": {\n      \"position\": \"relative\"\n    }\n  }, mdx(\"a\", {\n    parentName: \"h3\",\n    \"href\": \"#4-active-submit-button\",\n    \"aria-label\": \"4 active submit button permalink\",\n    \"className\": \"anchor before\"\n  }, mdx(\"svg\", {\n    parentName: \"a\",\n    \"aria-hidden\": \"true\",\n    \"focusable\": \"false\",\n    \"height\": \"16\",\n    \"version\": \"1.1\",\n    \"viewBox\": \"0 0 16 16\",\n    \"width\": \"16\"\n  }, mdx(\"path\", {\n    parentName: \"svg\",\n    \"fillRule\": \"evenodd\",\n    \"d\": \"M4 9h1v1H4c-1.5 0-3-1.69-3-3.5S2.55 3 4 3h4c1.45 0 3 1.69 3 3.5 0 1.41-.91 2.72-2 3.25V8.59c.58-.45 1-1.27 1-2.09C10 5.22 8.98 4 8 4H4c-.98 0-2 1.22-2 2.5S3 9 4 9zm9-3h-1v1h1c1 0 2 1.22 2 2.5S13.98 12 13 12H9c-.98 0-2-1.22-2-2.5 0-.83.42-1.64 1-2.09V6.25c-1.09.53-2 1.84-2 3.25C6 11.31 7.55 13 9 13h4c1.45 0 3-1.69 3-3.5S14.5 6 13 6z\"\n  }))), `4. Active submit button`), mdx(\"ul\", null, mdx(\"li\", {\n    parentName: \"ul\"\n  }, `Buttons at the end of forms work best with clear labels that reflect the overall user goal. `, mdx(\"em\", {\n    parentName: \"li\"\n  }, `Examples:`), ` \"Submit\" or \"Submit application\"`), mdx(\"li\", {\n    parentName: \"ul\"\n  }, `The buttons on the bottom of other pages in a multi-page form should read \"Next\" or \"Continue\".`), mdx(\"li\", {\n    parentName: \"ul\"\n  }, `Do not use disabled submit buttons. Allow the user to submit and then receive guidance through error summary and messages.`)), mdx(\"h2\", {\n    \"id\": \"guidance-for-all-errors\",\n    \"style\": {\n      \"position\": \"relative\"\n    }\n  }, mdx(\"a\", {\n    parentName: \"h2\",\n    \"href\": \"#guidance-for-all-errors\",\n    \"aria-label\": \"guidance for all errors permalink\",\n    \"className\": \"anchor before\"\n  }, mdx(\"svg\", {\n    parentName: \"a\",\n    \"aria-hidden\": \"true\",\n    \"focusable\": \"false\",\n    \"height\": \"16\",\n    \"version\": \"1.1\",\n    \"viewBox\": \"0 0 16 16\",\n    \"width\": \"16\"\n  }, mdx(\"path\", {\n    parentName: \"svg\",\n    \"fillRule\": \"evenodd\",\n    \"d\": \"M4 9h1v1H4c-1.5 0-3-1.69-3-3.5S2.55 3 4 3h4c1.45 0 3 1.69 3 3.5 0 1.41-.91 2.72-2 3.25V8.59c.58-.45 1-1.27 1-2.09C10 5.22 8.98 4 8 4H4c-.98 0-2 1.22-2 2.5S3 9 4 9zm9-3h-1v1h1c1 0 2 1.22 2 2.5S13.98 12 13 12H9c-.98 0-2-1.22-2-2.5 0-.83.42-1.64 1-2.09V6.25c-1.09.53-2 1.84-2 3.25C6 11.31 7.55 13 9 13h4c1.45 0 3-1.69 3-3.5S14.5 6 13 6z\"\n  }))), `Guidance for all errors`), mdx(\"h3\", {\n    \"id\": \"do\",\n    \"style\": {\n      \"position\": \"relative\"\n    }\n  }, mdx(\"a\", {\n    parentName: \"h3\",\n    \"href\": \"#do\",\n    \"aria-label\": \"do permalink\",\n    \"className\": \"anchor before\"\n  }, mdx(\"svg\", {\n    parentName: \"a\",\n    \"aria-hidden\": \"true\",\n    \"focusable\": \"false\",\n    \"height\": \"16\",\n    \"version\": \"1.1\",\n    \"viewBox\": \"0 0 16 16\",\n    \"width\": \"16\"\n  }, mdx(\"path\", {\n    parentName: \"svg\",\n    \"fillRule\": \"evenodd\",\n    \"d\": \"M4 9h1v1H4c-1.5 0-3-1.69-3-3.5S2.55 3 4 3h4c1.45 0 3 1.69 3 3.5 0 1.41-.91 2.72-2 3.25V8.59c.58-.45 1-1.27 1-2.09C10 5.22 8.98 4 8 4H4c-.98 0-2 1.22-2 2.5S3 9 4 9zm9-3h-1v1h1c1 0 2 1.22 2 2.5S13.98 12 13 12H9c-.98 0-2-1.22-2-2.5 0-.83.42-1.64 1-2.09V6.25c-1.09.53-2 1.84-2 3.25C6 11.31 7.55 13 9 13h4c1.45 0 3-1.69 3-3.5S14.5 6 13 6z\"\n  }))), `Do`), mdx(\"ul\", null, mdx(\"li\", {\n    parentName: \"ul\"\n  }, `Use the `, mdx(\"a\", {\n    parentName: \"li\",\n    \"href\": \"#validation-on-submit-default\"\n  }, `Validation on Submit`), ` for most use cases. Use `, mdx(\"a\", {\n    parentName: \"li\",\n    \"href\": \"#instant-validation\"\n  }, `Instant Validation`), ` when the answers aren't obvious or when input fields are difficult to complete.`), mdx(\"li\", {\n    parentName: \"ul\"\n  }, `Inline errors are built into all design system form fields but can be used on their own to create custom fields. See `, mdx(\"a\", {\n    parentName: \"li\",\n    \"href\": \"/design-system/branch/kniedermaier/WNMGDS-2835-update-docs-site/components/inline-error/\"\n  }, `Inline Error`), ` for more information.`), mdx(\"li\", {\n    parentName: \"ul\"\n  }, `Inline errors should sit either directly above or below the input, depending on the theme defaults.`), mdx(\"li\", {\n    parentName: \"ul\"\n  }, `Visually align inline validation messages with the input fields so people using screen magnifiers can read them quickly.`), mdx(\"li\", {\n    parentName: \"ul\"\n  }, `The form field should have an `, mdx(\"inlineCode\", {\n    parentName: \"li\"\n  }, `aria-describedby`), ` attribute that references the `, mdx(\"inlineCode\", {\n    parentName: \"li\"\n  }, `id`), ` of the error message.`), mdx(\"li\", {\n    parentName: \"ul\"\n  }, `Use color as a secondary way to draw attention to an error. Do not rely on color alone to indicate an error.`), mdx(\"li\", {\n    parentName: \"ul\"\n  }, `Include icons and messaging for each error field.`), mdx(\"li\", {\n    parentName: \"ul\"\n  }, `Place an icon in front of an error to draw attention to an error.`, mdx(\"ul\", {\n    parentName: \"li\"\n  }, mdx(\"li\", {\n    parentName: \"ul\"\n  }, `Hide the error icon from assistive technology by using `, mdx(\"inlineCode\", {\n    parentName: \"li\"\n  }, `aria-hidden=\"true\"`), ` and provide screen reader text to indicate an error ahead of the error message, typically done with \"Error\" as the screen reader text.`))), mdx(\"li\", {\n    parentName: \"ul\"\n  }, `Build your `, mdx(\"a\", {\n    parentName: \"li\",\n    \"href\": \"#error-message-content\"\n  }, `error message guidance`), ` alongside the form fields and form content, not as an afterthought.`), mdx(\"li\", {\n    parentName: \"ul\"\n  }, `Test to validate that users understand what went wrong and how to fix it.`)), mdx(\"h3\", {\n    \"id\": \"do-not\",\n    \"style\": {\n      \"position\": \"relative\"\n    }\n  }, mdx(\"a\", {\n    parentName: \"h3\",\n    \"href\": \"#do-not\",\n    \"aria-label\": \"do not permalink\",\n    \"className\": \"anchor before\"\n  }, mdx(\"svg\", {\n    parentName: \"a\",\n    \"aria-hidden\": \"true\",\n    \"focusable\": \"false\",\n    \"height\": \"16\",\n    \"version\": \"1.1\",\n    \"viewBox\": \"0 0 16 16\",\n    \"width\": \"16\"\n  }, mdx(\"path\", {\n    parentName: \"svg\",\n    \"fillRule\": \"evenodd\",\n    \"d\": \"M4 9h1v1H4c-1.5 0-3-1.69-3-3.5S2.55 3 4 3h4c1.45 0 3 1.69 3 3.5 0 1.41-.91 2.72-2 3.25V8.59c.58-.45 1-1.27 1-2.09C10 5.22 8.98 4 8 4H4c-.98 0-2 1.22-2 2.5S3 9 4 9zm9-3h-1v1h1c1 0 2 1.22 2 2.5S13.98 12 13 12H9c-.98 0-2-1.22-2-2.5 0-.83.42-1.64 1-2.09V6.25c-1.09.53-2 1.84-2 3.25C6 11.31 7.55 13 9 13h4c1.45 0 3-1.69 3-3.5S14.5 6 13 6z\"\n  }))), `Do not`), mdx(\"ul\", null, mdx(\"li\", {\n    parentName: \"ul\"\n  }, `When using choice children, do not use the error alert. Error messaging should be implemented with the error summary and inline error.`), mdx(\"li\", {\n    parentName: \"ul\"\n  }, `Do not use the warning alert if the error needs to be fixed for the user to continue.`), mdx(\"li\", {\n    parentName: \"ul\"\n  }, `Do not exceed 6-9 form fields on one page. If many inputs are in an error state, the list might be unmanageable for the user.`)), mdx(\"h2\", {\n    \"id\": \"error-message-content\",\n    \"style\": {\n      \"position\": \"relative\"\n    }\n  }, mdx(\"a\", {\n    parentName: \"h2\",\n    \"href\": \"#error-message-content\",\n    \"aria-label\": \"error message content permalink\",\n    \"className\": \"anchor before\"\n  }, mdx(\"svg\", {\n    parentName: \"a\",\n    \"aria-hidden\": \"true\",\n    \"focusable\": \"false\",\n    \"height\": \"16\",\n    \"version\": \"1.1\",\n    \"viewBox\": \"0 0 16 16\",\n    \"width\": \"16\"\n  }, mdx(\"path\", {\n    parentName: \"svg\",\n    \"fillRule\": \"evenodd\",\n    \"d\": \"M4 9h1v1H4c-1.5 0-3-1.69-3-3.5S2.55 3 4 3h4c1.45 0 3 1.69 3 3.5 0 1.41-.91 2.72-2 3.25V8.59c.58-.45 1-1.27 1-2.09C10 5.22 8.98 4 8 4H4c-.98 0-2 1.22-2 2.5S3 9 4 9zm9-3h-1v1h1c1 0 2 1.22 2 2.5S13.98 12 13 12H9c-.98 0-2-1.22-2-2.5 0-.83.42-1.64 1-2.09V6.25c-1.09.53-2 1.84-2 3.25C6 11.31 7.55 13 9 13h4c1.45 0 3-1.69 3-3.5S14.5 6 13 6z\"\n  }))), `Error message content`), mdx(\"p\", null, `An error message, in both inline errors and error summaries, must include what the user can do to fix the error.`), mdx(\"ul\", null, mdx(\"li\", {\n    parentName: \"ul\"\n  }, `Inline errors only state how to fix the issue so the user completes the field correctly.`), mdx(\"li\", {\n    parentName: \"ul\"\n  }, `Summary error messages include introduction text that reminds the user what's needed in order to complete the action. It also lists the fields to fix and their corresponding inline error messages`, `—`, `the exact same content should be used for the field title and inline error message.`)), mdx(\"h3\", {\n    \"id\": \"all-messages-must\",\n    \"style\": {\n      \"position\": \"relative\"\n    }\n  }, mdx(\"a\", {\n    parentName: \"h3\",\n    \"href\": \"#all-messages-must\",\n    \"aria-label\": \"all messages must permalink\",\n    \"className\": \"anchor before\"\n  }, mdx(\"svg\", {\n    parentName: \"a\",\n    \"aria-hidden\": \"true\",\n    \"focusable\": \"false\",\n    \"height\": \"16\",\n    \"version\": \"1.1\",\n    \"viewBox\": \"0 0 16 16\",\n    \"width\": \"16\"\n  }, mdx(\"path\", {\n    parentName: \"svg\",\n    \"fillRule\": \"evenodd\",\n    \"d\": \"M4 9h1v1H4c-1.5 0-3-1.69-3-3.5S2.55 3 4 3h4c1.45 0 3 1.69 3 3.5 0 1.41-.91 2.72-2 3.25V8.59c.58-.45 1-1.27 1-2.09C10 5.22 8.98 4 8 4H4c-.98 0-2 1.22-2 2.5S3 9 4 9zm9-3h-1v1h1c1 0 2 1.22 2 2.5S13.98 12 13 12H9c-.98 0-2-1.22-2-2.5 0-.83.42-1.64 1-2.09V6.25c-1.09.53-2 1.84-2 3.25C6 11.31 7.55 13 9 13h4c1.45 0 3-1.69 3-3.5S14.5 6 13 6z\"\n  }))), `All messages must:`), mdx(\"ul\", null, mdx(\"li\", {\n    parentName: \"ul\"\n  }, `Be specific, short, and consistent.`), mdx(\"li\", {\n    parentName: \"ul\"\n  }, `Be in plain English/plain language.`), mdx(\"li\", {\n    parentName: \"ul\"\n  }, `Use imperative style (give a direct command to the user).`), mdx(\"li\", {\n    parentName: \"ul\"\n  }, `Specify what the user needs to do to fix the issue (using positive framing).`), mdx(\"li\", {\n    parentName: \"ul\"\n  }, `Give enough detail to help the user solve the problem or continue to the next step, while using the fewest words possible.`, mdx(\"ul\", {\n    parentName: \"li\"\n  }, mdx(\"li\", {\n    parentName: \"ul\"\n  }, mdx(\"em\", {\n    parentName: \"li\"\n  }, `Examples:`), mdx(\"ul\", {\n    parentName: \"li\"\n  }, mdx(\"li\", {\n    parentName: \"ul\"\n  }, `\"Enter a 10-digit United States phone number.\"`), mdx(\"li\", {\n    parentName: \"ul\"\n  }, `\"Enter an email address with @ symbol and email domain, like \".com\".\"`), mdx(\"li\", {\n    parentName: \"ul\"\n  }, `\"Enter birthdate as MM/DD/YYYY.\"`))))), mdx(\"li\", {\n    parentName: \"ul\"\n  }, `Use a single error message when there are multiple fields related to the same thing, like date (month, day, year).`), mdx(\"li\", {\n    parentName: \"ul\"\n  }, `Use sentence case.`), mdx(\"li\", {\n    parentName: \"ul\"\n  }, `End with a period.`), mdx(\"li\", {\n    parentName: \"ul\"\n  }, `Include language from the question or fieldset label`, `—`, `this helps match up the error message with the relevant form field.`, mdx(\"ul\", {\n    parentName: \"li\"\n  }, mdx(\"li\", {\n    parentName: \"ul\"\n  }, mdx(\"em\", {\n    parentName: \"li\"\n  }, `Example:`), mdx(\"ul\", {\n    parentName: \"li\"\n  }, mdx(\"li\", {\n    parentName: \"ul\"\n  }, `Field label is \"Street address.\" Inline error message is \"Enter a street address with building number and road name.\" Both the label and error message include \"street address\" for better user comprehension on how to fix the error.`))))), mdx(\"li\", {\n    parentName: \"ul\"\n  }, `Sound human`, `—`, `read the message out loud to see if it sounds like something you would say.`), mdx(\"li\", {\n    parentName: \"ul\"\n  }, `Test error messages to validate that users understand what went wrong and how to fix the error.`)), mdx(\"h3\", {\n    \"id\": \"avoid-the-following-in-error-messages\",\n    \"style\": {\n      \"position\": \"relative\"\n    }\n  }, mdx(\"a\", {\n    parentName: \"h3\",\n    \"href\": \"#avoid-the-following-in-error-messages\",\n    \"aria-label\": \"avoid the following in error messages permalink\",\n    \"className\": \"anchor before\"\n  }, mdx(\"svg\", {\n    parentName: \"a\",\n    \"aria-hidden\": \"true\",\n    \"focusable\": \"false\",\n    \"height\": \"16\",\n    \"version\": \"1.1\",\n    \"viewBox\": \"0 0 16 16\",\n    \"width\": \"16\"\n  }, mdx(\"path\", {\n    parentName: \"svg\",\n    \"fillRule\": \"evenodd\",\n    \"d\": \"M4 9h1v1H4c-1.5 0-3-1.69-3-3.5S2.55 3 4 3h4c1.45 0 3 1.69 3 3.5 0 1.41-.91 2.72-2 3.25V8.59c.58-.45 1-1.27 1-2.09C10 5.22 8.98 4 8 4H4c-.98 0-2 1.22-2 2.5S3 9 4 9zm9-3h-1v1h1c1 0 2 1.22 2 2.5S13.98 12 13 12H9c-.98 0-2-1.22-2-2.5 0-.83.42-1.64 1-2.09V6.25c-1.09.53-2 1.84-2 3.25C6 11.31 7.55 13 9 13h4c1.45 0 3-1.69 3-3.5S14.5 6 13 6z\"\n  }))), `Avoid the following in error messages:`), mdx(\"ul\", null, mdx(\"li\", {\n    parentName: \"ul\"\n  }, `Don't be too generic: General error messages don't help the user to fix the problem.`, mdx(\"ul\", {\n    parentName: \"li\"\n  }, mdx(\"li\", {\n    parentName: \"ul\"\n  }, mdx(\"em\", {\n    parentName: \"li\"\n  }, `Examples:`), mdx(\"ul\", {\n    parentName: \"li\"\n  }, mdx(\"li\", {\n    parentName: \"ul\"\n  }, `\"An error occurred.\"`), mdx(\"li\", {\n    parentName: \"ul\"\n  }, `\"Answer the question.\"`), mdx(\"li\", {\n    parentName: \"ul\"\n  }, `\"Select an option.\"`), mdx(\"li\", {\n    parentName: \"ul\"\n  }, `\"Required field.\"`))))), mdx(\"li\", {\n    parentName: \"ul\"\n  }, `Don't use the verbs \"see\" and \"view\" unless it would be awkward to use another verb. These can be used, but they should be the last choice (accessibility issue).`), mdx(\"li\", {\n    parentName: \"ul\"\n  }, `Don't use words like \"please\" or \"sorry,\" or informal language like \"oops.\"`), mdx(\"li\", {\n    parentName: \"ul\"\n  }, `Don't use technical jargon like, \"Unspecified error,\" and \"Issue 567 error.\"`), mdx(\"li\", {\n    parentName: \"ul\"\n  }, `Don't use negative words like, \"forbidden,\" \"illegal,\" \"you forgot,\" \"you didn't,\" and \"prohibited.\"`), mdx(\"li\", {\n    parentName: \"ul\"\n  }, `Don't use \"valid\" and \"invalid,\" as these words can mean a lot of different things and are not commonly used words for non-native English speakers.`)), mdx(\"h2\", {\n    \"id\": \"validation-on-submit-default\",\n    \"style\": {\n      \"position\": \"relative\"\n    }\n  }, mdx(\"a\", {\n    parentName: \"h2\",\n    \"href\": \"#validation-on-submit-default\",\n    \"aria-label\": \"validation on submit default permalink\",\n    \"className\": \"anchor before\"\n  }, mdx(\"svg\", {\n    parentName: \"a\",\n    \"aria-hidden\": \"true\",\n    \"focusable\": \"false\",\n    \"height\": \"16\",\n    \"version\": \"1.1\",\n    \"viewBox\": \"0 0 16 16\",\n    \"width\": \"16\"\n  }, mdx(\"path\", {\n    parentName: \"svg\",\n    \"fillRule\": \"evenodd\",\n    \"d\": \"M4 9h1v1H4c-1.5 0-3-1.69-3-3.5S2.55 3 4 3h4c1.45 0 3 1.69 3 3.5 0 1.41-.91 2.72-2 3.25V8.59c.58-.45 1-1.27 1-2.09C10 5.22 8.98 4 8 4H4c-.98 0-2 1.22-2 2.5S3 9 4 9zm9-3h-1v1h1c1 0 2 1.22 2 2.5S13.98 12 13 12H9c-.98 0-2-1.22-2-2.5 0-.83.42-1.64 1-2.09V6.25c-1.09.53-2 1.84-2 3.25C6 11.31 7.55 13 9 13h4c1.45 0 3-1.69 3-3.5S14.5 6 13 6z\"\n  }))), `Validation on Submit (default)`), mdx(\"p\", null, mdx(\"strong\", {\n    parentName: \"p\"\n  }, `This is the recommended type of error validation for most use cases.`)), mdx(\"p\", null, `Validation on Submit uses the error summary message and inline errors to provide a clear list of errors after \"submit\" is clicked. When errors are found, feedback is returned and displayed to the user in an error summary at the top of the page with corresponding inline messages next to the incorrect fields. This allows users to fill out the form without interruptions and guides them in finding and fixing errors.`), mdx(\"p\", null, `The `, mdx(\"a\", {\n    parentName: \"p\",\n    \"href\": \"#validation-on-submit-default\"\n  }, `Validation on Submit`), ` pattern is composed of an error summary, form fields, and an active button.`), mdx(\"h3\", {\n    \"id\": \"when-to-use\",\n    \"style\": {\n      \"position\": \"relative\"\n    }\n  }, mdx(\"a\", {\n    parentName: \"h3\",\n    \"href\": \"#when-to-use\",\n    \"aria-label\": \"when to use permalink\",\n    \"className\": \"anchor before\"\n  }, mdx(\"svg\", {\n    parentName: \"a\",\n    \"aria-hidden\": \"true\",\n    \"focusable\": \"false\",\n    \"height\": \"16\",\n    \"version\": \"1.1\",\n    \"viewBox\": \"0 0 16 16\",\n    \"width\": \"16\"\n  }, mdx(\"path\", {\n    parentName: \"svg\",\n    \"fillRule\": \"evenodd\",\n    \"d\": \"M4 9h1v1H4c-1.5 0-3-1.69-3-3.5S2.55 3 4 3h4c1.45 0 3 1.69 3 3.5 0 1.41-.91 2.72-2 3.25V8.59c.58-.45 1-1.27 1-2.09C10 5.22 8.98 4 8 4H4c-.98 0-2 1.22-2 2.5S3 9 4 9zm9-3h-1v1h1c1 0 2 1.22 2 2.5S13.98 12 13 12H9c-.98 0-2-1.22-2-2.5 0-.83.42-1.64 1-2.09V6.25c-1.09.53-2 1.84-2 3.25C6 11.31 7.55 13 9 13h4c1.45 0 3-1.69 3-3.5S14.5 6 13 6z\"\n  }))), `When to use`), mdx(\"ul\", null, mdx(\"li\", {\n    parentName: \"ul\"\n  }, `This is the preferred style of error validation and should be used in most cases.`)), mdx(\"h3\", {\n    \"id\": \"when-to-consider-alternatives\",\n    \"style\": {\n      \"position\": \"relative\"\n    }\n  }, mdx(\"a\", {\n    parentName: \"h3\",\n    \"href\": \"#when-to-consider-alternatives\",\n    \"aria-label\": \"when to consider alternatives permalink\",\n    \"className\": \"anchor before\"\n  }, mdx(\"svg\", {\n    parentName: \"a\",\n    \"aria-hidden\": \"true\",\n    \"focusable\": \"false\",\n    \"height\": \"16\",\n    \"version\": \"1.1\",\n    \"viewBox\": \"0 0 16 16\",\n    \"width\": \"16\"\n  }, mdx(\"path\", {\n    parentName: \"svg\",\n    \"fillRule\": \"evenodd\",\n    \"d\": \"M4 9h1v1H4c-1.5 0-3-1.69-3-3.5S2.55 3 4 3h4c1.45 0 3 1.69 3 3.5 0 1.41-.91 2.72-2 3.25V8.59c.58-.45 1-1.27 1-2.09C10 5.22 8.98 4 8 4H4c-.98 0-2 1.22-2 2.5S3 9 4 9zm9-3h-1v1h1c1 0 2 1.22 2 2.5S13.98 12 13 12H9c-.98 0-2-1.22-2-2.5 0-.83.42-1.64 1-2.09V6.25c-1.09.53-2 1.84-2 3.25C6 11.31 7.55 13 9 13h4c1.45 0 3-1.69 3-3.5S14.5 6 13 6z\"\n  }))), `When to consider alternatives`), mdx(\"ul\", null, mdx(\"li\", {\n    parentName: \"ul\"\n  }, `Use `, mdx(\"a\", {\n    parentName: \"li\",\n    \"href\": \"#instant-validation\"\n  }, `Instant Validation`), ` only if your user research shows that it solves more problems than it causes. This should be limited to very specific and short use cases. For example, single, complicated form fields, such as creating secure passwords, can benefit from instant validation.`)), mdx(\"h3\", {\n    \"id\": \"do-1\",\n    \"style\": {\n      \"position\": \"relative\"\n    }\n  }, mdx(\"a\", {\n    parentName: \"h3\",\n    \"href\": \"#do-1\",\n    \"aria-label\": \"do 1 permalink\",\n    \"className\": \"anchor before\"\n  }, mdx(\"svg\", {\n    parentName: \"a\",\n    \"aria-hidden\": \"true\",\n    \"focusable\": \"false\",\n    \"height\": \"16\",\n    \"version\": \"1.1\",\n    \"viewBox\": \"0 0 16 16\",\n    \"width\": \"16\"\n  }, mdx(\"path\", {\n    parentName: \"svg\",\n    \"fillRule\": \"evenodd\",\n    \"d\": \"M4 9h1v1H4c-1.5 0-3-1.69-3-3.5S2.55 3 4 3h4c1.45 0 3 1.69 3 3.5 0 1.41-.91 2.72-2 3.25V8.59c.58-.45 1-1.27 1-2.09C10 5.22 8.98 4 8 4H4c-.98 0-2 1.22-2 2.5S3 9 4 9zm9-3h-1v1h1c1 0 2 1.22 2 2.5S13.98 12 13 12H9c-.98 0-2-1.22-2-2.5 0-.83.42-1.64 1-2.09V6.25c-1.09.53-2 1.84-2 3.25C6 11.31 7.55 13 9 13h4c1.45 0 3-1.69 3-3.5S14.5 6 13 6z\"\n  }))), `Do`), mdx(\"ul\", null, mdx(\"li\", {\n    parentName: \"ul\"\n  }, `Perform validation on all inputs when the button is clicked.`), mdx(\"li\", {\n    parentName: \"ul\"\n  }, `Show an error summary at the top of the page. Always show an error summary when there is a validation error, even if there's only one.`), mdx(\"li\", {\n    parentName: \"ul\"\n  }, `Show appropriate error messages next to the correlated field label and in the error summary.`), mdx(\"li\", {\n    parentName: \"ul\"\n  }, `Break down forms into smaller sections. Keep the maximum number of form fields to 5-9 on one page. If many inputs are in an error state, the list might be unmanageable for the user.`)), mdx(\"h3\", {\n    \"id\": \"do-not-1\",\n    \"style\": {\n      \"position\": \"relative\"\n    }\n  }, mdx(\"a\", {\n    parentName: \"h3\",\n    \"href\": \"#do-not-1\",\n    \"aria-label\": \"do not 1 permalink\",\n    \"className\": \"anchor before\"\n  }, mdx(\"svg\", {\n    parentName: \"a\",\n    \"aria-hidden\": \"true\",\n    \"focusable\": \"false\",\n    \"height\": \"16\",\n    \"version\": \"1.1\",\n    \"viewBox\": \"0 0 16 16\",\n    \"width\": \"16\"\n  }, mdx(\"path\", {\n    parentName: \"svg\",\n    \"fillRule\": \"evenodd\",\n    \"d\": \"M4 9h1v1H4c-1.5 0-3-1.69-3-3.5S2.55 3 4 3h4c1.45 0 3 1.69 3 3.5 0 1.41-.91 2.72-2 3.25V8.59c.58-.45 1-1.27 1-2.09C10 5.22 8.98 4 8 4H4c-.98 0-2 1.22-2 2.5S3 9 4 9zm9-3h-1v1h1c1 0 2 1.22 2 2.5S13.98 12 13 12H9c-.98 0-2-1.22-2-2.5 0-.83.42-1.64 1-2.09V6.25c-1.09.53-2 1.84-2 3.25C6 11.31 7.55 13 9 13h4c1.45 0 3-1.69 3-3.5S14.5 6 13 6z\"\n  }))), `Do not`), mdx(\"ul\", null, mdx(\"li\", {\n    parentName: \"ul\"\n  }, `Do not clear any form fields when validating users' answers. Keep both passing and failing answers. This is to comply with WCAG 2.2 success criterion `, mdx(\"a\", {\n    parentName: \"li\",\n    \"href\": \"https://www.w3.org/WAI/WCAG22/Understanding/redundant-entry.html\"\n  }, `3.3.7 Redundant Entry`), `. Keeping information that failed validation helps users to see what went wrong, edit their previous answer, and avoid re-entering information.`), mdx(\"li\", {\n    parentName: \"ul\"\n  }, `Avoid using disabled buttons by default on page load. It is preferred to show users an error message when required inputs aren't provided.`), mdx(\"li\", {\n    parentName: \"ul\"\n  }, `Do not exceed 6-9 form fields on one page. If many inputs are in an error state, the list might be unmanageable for the user.`)), mdx(\"h3\", {\n    \"id\": \"accessibility\",\n    \"style\": {\n      \"position\": \"relative\"\n    }\n  }, mdx(\"a\", {\n    parentName: \"h3\",\n    \"href\": \"#accessibility\",\n    \"aria-label\": \"accessibility permalink\",\n    \"className\": \"anchor before\"\n  }, mdx(\"svg\", {\n    parentName: \"a\",\n    \"aria-hidden\": \"true\",\n    \"focusable\": \"false\",\n    \"height\": \"16\",\n    \"version\": \"1.1\",\n    \"viewBox\": \"0 0 16 16\",\n    \"width\": \"16\"\n  }, mdx(\"path\", {\n    parentName: \"svg\",\n    \"fillRule\": \"evenodd\",\n    \"d\": \"M4 9h1v1H4c-1.5 0-3-1.69-3-3.5S2.55 3 4 3h4c1.45 0 3 1.69 3 3.5 0 1.41-.91 2.72-2 3.25V8.59c.58-.45 1-1.27 1-2.09C10 5.22 8.98 4 8 4H4c-.98 0-2 1.22-2 2.5S3 9 4 9zm9-3h-1v1h1c1 0 2 1.22 2 2.5S13.98 12 13 12H9c-.98 0-2-1.22-2-2.5 0-.83.42-1.64 1-2.09V6.25c-1.09.53-2 1.84-2 3.25C6 11.31 7.55 13 9 13h4c1.45 0 3-1.69 3-3.5S14.5 6 13 6z\"\n  }))), `Accessibility`), mdx(\"ul\", null, mdx(\"li\", {\n    parentName: \"ul\"\n  }, `Place error summary below the `, mdx(\"inlineCode\", {\n    parentName: \"li\"\n  }, `<h1>`), ` and above the form fields.`), mdx(\"li\", {\n    parentName: \"ul\"\n  }, `Shift focus to the error summary heading at the top of the page and use the `, mdx(\"inlineCode\", {\n    parentName: \"li\"\n  }, `aria-labelledby`), ` attribute to give it an accessible name. This should not be in the tab order and it also should not include a visible focus ring.`), mdx(\"li\", {\n    parentName: \"ul\"\n  }, `If the page is reloaded on form submission, add \"Error: \" to the beginning of the page `, mdx(\"inlineCode\", {\n    parentName: \"li\"\n  }, `<title>`), `.`)), mdx(\"h3\", {\n    \"id\": \"screen-reader-testing\",\n    \"style\": {\n      \"position\": \"relative\"\n    }\n  }, mdx(\"a\", {\n    parentName: \"h3\",\n    \"href\": \"#screen-reader-testing\",\n    \"aria-label\": \"screen reader testing permalink\",\n    \"className\": \"anchor before\"\n  }, mdx(\"svg\", {\n    parentName: \"a\",\n    \"aria-hidden\": \"true\",\n    \"focusable\": \"false\",\n    \"height\": \"16\",\n    \"version\": \"1.1\",\n    \"viewBox\": \"0 0 16 16\",\n    \"width\": \"16\"\n  }, mdx(\"path\", {\n    parentName: \"svg\",\n    \"fillRule\": \"evenodd\",\n    \"d\": \"M4 9h1v1H4c-1.5 0-3-1.69-3-3.5S2.55 3 4 3h4c1.45 0 3 1.69 3 3.5 0 1.41-.91 2.72-2 3.25V8.59c.58-.45 1-1.27 1-2.09C10 5.22 8.98 4 8 4H4c-.98 0-2 1.22-2 2.5S3 9 4 9zm9-3h-1v1h1c1 0 2 1.22 2 2.5S13.98 12 13 12H9c-.98 0-2-1.22-2-2.5 0-.83.42-1.64 1-2.09V6.25c-1.09.53-2 1.84-2 3.25C6 11.31 7.55 13 9 13h4c1.45 0 3-1.69 3-3.5S14.5 6 13 6z\"\n  }))), `Screen reader testing`), mdx(\"ul\", null, mdx(\"li\", {\n    parentName: \"ul\"\n  }, `When the input field gets focus, its label should be read first and then its hint (if it has one) and its error message.`)), mdx(\"h3\", {\n    \"id\": \"examples\",\n    \"style\": {\n      \"position\": \"relative\"\n    }\n  }, mdx(\"a\", {\n    parentName: \"h3\",\n    \"href\": \"#examples\",\n    \"aria-label\": \"examples permalink\",\n    \"className\": \"anchor before\"\n  }, mdx(\"svg\", {\n    parentName: \"a\",\n    \"aria-hidden\": \"true\",\n    \"focusable\": \"false\",\n    \"height\": \"16\",\n    \"version\": \"1.1\",\n    \"viewBox\": \"0 0 16 16\",\n    \"width\": \"16\"\n  }, mdx(\"path\", {\n    parentName: \"svg\",\n    \"fillRule\": \"evenodd\",\n    \"d\": \"M4 9h1v1H4c-1.5 0-3-1.69-3-3.5S2.55 3 4 3h4c1.45 0 3 1.69 3 3.5 0 1.41-.91 2.72-2 3.25V8.59c.58-.45 1-1.27 1-2.09C10 5.22 8.98 4 8 4H4c-.98 0-2 1.22-2 2.5S3 9 4 9zm9-3h-1v1h1c1 0 2 1.22 2 2.5S13.98 12 13 12H9c-.98 0-2-1.22-2-2.5 0-.83.42-1.64 1-2.09V6.25c-1.09.53-2 1.84-2 3.25C6 11.31 7.55 13 9 13h4c1.45 0 3-1.69 3-3.5S14.5 6 13 6z\"\n  }))), `Examples`), mdx(\"h4\", {\n    \"id\": \"error-summary\",\n    \"style\": {\n      \"position\": \"relative\"\n    }\n  }, mdx(\"a\", {\n    parentName: \"h4\",\n    \"href\": \"#error-summary\",\n    \"aria-label\": \"error summary permalink\",\n    \"className\": \"anchor before\"\n  }, mdx(\"svg\", {\n    parentName: \"a\",\n    \"aria-hidden\": \"true\",\n    \"focusable\": \"false\",\n    \"height\": \"16\",\n    \"version\": \"1.1\",\n    \"viewBox\": \"0 0 16 16\",\n    \"width\": \"16\"\n  }, mdx(\"path\", {\n    parentName: \"svg\",\n    \"fillRule\": \"evenodd\",\n    \"d\": \"M4 9h1v1H4c-1.5 0-3-1.69-3-3.5S2.55 3 4 3h4c1.45 0 3 1.69 3 3.5 0 1.41-.91 2.72-2 3.25V8.59c.58-.45 1-1.27 1-2.09C10 5.22 8.98 4 8 4H4c-.98 0-2 1.22-2 2.5S3 9 4 9zm9-3h-1v1h1c1 0 2 1.22 2 2.5S13.98 12 13 12H9c-.98 0-2-1.22-2-2.5 0-.83.42-1.64 1-2.09V6.25c-1.09.53-2 1.84-2 3.25C6 11.31 7.55 13 9 13h4c1.45 0 3-1.69 3-3.5S14.5 6 13 6z\"\n  }))), `Error summary`), mdx(StorybookExample, {\n    componentName: \"autocomplete\",\n    storyId: \"patterns-error-validation-examples--error-summary\",\n    minHeight: 200,\n    mdxType: \"StorybookExample\"\n  }), mdx(\"h4\", {\n    \"id\": \"single-error\",\n    \"style\": {\n      \"position\": \"relative\"\n    }\n  }, mdx(\"a\", {\n    parentName: \"h4\",\n    \"href\": \"#single-error\",\n    \"aria-label\": \"single error permalink\",\n    \"className\": \"anchor before\"\n  }, mdx(\"svg\", {\n    parentName: \"a\",\n    \"aria-hidden\": \"true\",\n    \"focusable\": \"false\",\n    \"height\": \"16\",\n    \"version\": \"1.1\",\n    \"viewBox\": \"0 0 16 16\",\n    \"width\": \"16\"\n  }, mdx(\"path\", {\n    parentName: \"svg\",\n    \"fillRule\": \"evenodd\",\n    \"d\": \"M4 9h1v1H4c-1.5 0-3-1.69-3-3.5S2.55 3 4 3h4c1.45 0 3 1.69 3 3.5 0 1.41-.91 2.72-2 3.25V8.59c.58-.45 1-1.27 1-2.09C10 5.22 8.98 4 8 4H4c-.98 0-2 1.22-2 2.5S3 9 4 9zm9-3h-1v1h1c1 0 2 1.22 2 2.5S13.98 12 13 12H9c-.98 0-2-1.22-2-2.5 0-.83.42-1.64 1-2.09V6.25c-1.09.53-2 1.84-2 3.25C6 11.31 7.55 13 9 13h4c1.45 0 3-1.69 3-3.5S14.5 6 13 6z\"\n  }))), `Single error`), mdx(StorybookExample, {\n    componentName: \"autocomplete\",\n    storyId: \"patterns-error-validation-examples--single-error\",\n    minHeight: 600,\n    mdxType: \"StorybookExample\"\n  }), mdx(\"h4\", {\n    \"id\": \"multiple-errors\",\n    \"style\": {\n      \"position\": \"relative\"\n    }\n  }, mdx(\"a\", {\n    parentName: \"h4\",\n    \"href\": \"#multiple-errors\",\n    \"aria-label\": \"multiple errors permalink\",\n    \"className\": \"anchor before\"\n  }, mdx(\"svg\", {\n    parentName: \"a\",\n    \"aria-hidden\": \"true\",\n    \"focusable\": \"false\",\n    \"height\": \"16\",\n    \"version\": \"1.1\",\n    \"viewBox\": \"0 0 16 16\",\n    \"width\": \"16\"\n  }, mdx(\"path\", {\n    parentName: \"svg\",\n    \"fillRule\": \"evenodd\",\n    \"d\": \"M4 9h1v1H4c-1.5 0-3-1.69-3-3.5S2.55 3 4 3h4c1.45 0 3 1.69 3 3.5 0 1.41-.91 2.72-2 3.25V8.59c.58-.45 1-1.27 1-2.09C10 5.22 8.98 4 8 4H4c-.98 0-2 1.22-2 2.5S3 9 4 9zm9-3h-1v1h1c1 0 2 1.22 2 2.5S13.98 12 13 12H9c-.98 0-2-1.22-2-2.5 0-.83.42-1.64 1-2.09V6.25c-1.09.53-2 1.84-2 3.25C6 11.31 7.55 13 9 13h4c1.45 0 3-1.69 3-3.5S14.5 6 13 6z\"\n  }))), `Multiple errors`), mdx(StorybookExample, {\n    componentName: \"autocomplete\",\n    storyId: \"patterns-error-validation-examples--multiple-errors\",\n    minHeight: 800,\n    mdxType: \"StorybookExample\"\n  }), mdx(\"h2\", {\n    \"id\": \"instant-validation\",\n    \"style\": {\n      \"position\": \"relative\"\n    }\n  }, mdx(\"a\", {\n    parentName: \"h2\",\n    \"href\": \"#instant-validation\",\n    \"aria-label\": \"instant validation permalink\",\n    \"className\": \"anchor before\"\n  }, mdx(\"svg\", {\n    parentName: \"a\",\n    \"aria-hidden\": \"true\",\n    \"focusable\": \"false\",\n    \"height\": \"16\",\n    \"version\": \"1.1\",\n    \"viewBox\": \"0 0 16 16\",\n    \"width\": \"16\"\n  }, mdx(\"path\", {\n    parentName: \"svg\",\n    \"fillRule\": \"evenodd\",\n    \"d\": \"M4 9h1v1H4c-1.5 0-3-1.69-3-3.5S2.55 3 4 3h4c1.45 0 3 1.69 3 3.5 0 1.41-.91 2.72-2 3.25V8.59c.58-.45 1-1.27 1-2.09C10 5.22 8.98 4 8 4H4c-.98 0-2 1.22-2 2.5S3 9 4 9zm9-3h-1v1h1c1 0 2 1.22 2 2.5S13.98 12 13 12H9c-.98 0-2-1.22-2-2.5 0-.83.42-1.64 1-2.09V6.25c-1.09.53-2 1.84-2 3.25C6 11.31 7.55 13 9 13h4c1.45 0 3-1.69 3-3.5S14.5 6 13 6z\"\n  }))), `Instant Validation`), mdx(\"p\", null, `Instant Validation, or dynamic validation, shows an inline error next to the incorrect field after the user has moved focus away from the form field. This allows the user to fix the error immediately rather than after the form has been submitted.`), mdx(\"p\", null, `Instant Validation should be implemented carefully and in appropriate cases because it might be distracting if overused or misused. Only add Instant Validation if your user research shows that it solves more problems than it causes. This should be limited to very specific and short use cases. When used appropriately, Instant Validation can greatly reduce cognitive load of the user by avoiding the task of locating the incorrect input.`), mdx(\"h3\", {\n    \"id\": \"when-to-use-1\",\n    \"style\": {\n      \"position\": \"relative\"\n    }\n  }, mdx(\"a\", {\n    parentName: \"h3\",\n    \"href\": \"#when-to-use-1\",\n    \"aria-label\": \"when to use 1 permalink\",\n    \"className\": \"anchor before\"\n  }, mdx(\"svg\", {\n    parentName: \"a\",\n    \"aria-hidden\": \"true\",\n    \"focusable\": \"false\",\n    \"height\": \"16\",\n    \"version\": \"1.1\",\n    \"viewBox\": \"0 0 16 16\",\n    \"width\": \"16\"\n  }, mdx(\"path\", {\n    parentName: \"svg\",\n    \"fillRule\": \"evenodd\",\n    \"d\": \"M4 9h1v1H4c-1.5 0-3-1.69-3-3.5S2.55 3 4 3h4c1.45 0 3 1.69 3 3.5 0 1.41-.91 2.72-2 3.25V8.59c.58-.45 1-1.27 1-2.09C10 5.22 8.98 4 8 4H4c-.98 0-2 1.22-2 2.5S3 9 4 9zm9-3h-1v1h1c1 0 2 1.22 2 2.5S13.98 12 13 12H9c-.98 0-2-1.22-2-2.5 0-.83.42-1.64 1-2.09V6.25c-1.09.53-2 1.84-2 3.25C6 11.31 7.55 13 9 13h4c1.45 0 3-1.69 3-3.5S14.5 6 13 6z\"\n  }))), `When to use`), mdx(\"ul\", null, mdx(\"li\", {\n    parentName: \"ul\"\n  }, `Use Instant Validation when the answers aren't obvious or when input fields are difficult to complete. For example, single, complicated form fields, such as creating usernames or secure passwords or confirming email addresses and dates.`)), mdx(\"h3\", {\n    \"id\": \"when-to-consider-alternatives-1\",\n    \"style\": {\n      \"position\": \"relative\"\n    }\n  }, mdx(\"a\", {\n    parentName: \"h3\",\n    \"href\": \"#when-to-consider-alternatives-1\",\n    \"aria-label\": \"when to consider alternatives 1 permalink\",\n    \"className\": \"anchor before\"\n  }, mdx(\"svg\", {\n    parentName: \"a\",\n    \"aria-hidden\": \"true\",\n    \"focusable\": \"false\",\n    \"height\": \"16\",\n    \"version\": \"1.1\",\n    \"viewBox\": \"0 0 16 16\",\n    \"width\": \"16\"\n  }, mdx(\"path\", {\n    parentName: \"svg\",\n    \"fillRule\": \"evenodd\",\n    \"d\": \"M4 9h1v1H4c-1.5 0-3-1.69-3-3.5S2.55 3 4 3h4c1.45 0 3 1.69 3 3.5 0 1.41-.91 2.72-2 3.25V8.59c.58-.45 1-1.27 1-2.09C10 5.22 8.98 4 8 4H4c-.98 0-2 1.22-2 2.5S3 9 4 9zm9-3h-1v1h1c1 0 2 1.22 2 2.5S13.98 12 13 12H9c-.98 0-2-1.22-2-2.5 0-.83.42-1.64 1-2.09V6.25c-1.09.53-2 1.84-2 3.25C6 11.31 7.55 13 9 13h4c1.45 0 3-1.69 3-3.5S14.5 6 13 6z\"\n  }))), `When to consider alternatives`), mdx(\"ul\", null, mdx(\"li\", {\n    parentName: \"ul\"\n  }, `When in doubt, default to `, mdx(\"a\", {\n    parentName: \"li\",\n    \"href\": \"#validation-on-submit-default\"\n  }, `Validation on Submit`), `. Instant validation should be implemented carefully and in appropriate cases because it might be distracting if overused or misused.`), mdx(\"li\", {\n    parentName: \"ul\"\n  }, `Use `, mdx(\"a\", {\n    parentName: \"li\",\n    \"href\": \"#validation-on-submit-default\"\n  }, `Validation on Submit`), ` for services which cannot use JavaScript for dynamic approach.`)), mdx(\"h3\", {\n    \"id\": \"do-2\",\n    \"style\": {\n      \"position\": \"relative\"\n    }\n  }, mdx(\"a\", {\n    parentName: \"h3\",\n    \"href\": \"#do-2\",\n    \"aria-label\": \"do 2 permalink\",\n    \"className\": \"anchor before\"\n  }, mdx(\"svg\", {\n    parentName: \"a\",\n    \"aria-hidden\": \"true\",\n    \"focusable\": \"false\",\n    \"height\": \"16\",\n    \"version\": \"1.1\",\n    \"viewBox\": \"0 0 16 16\",\n    \"width\": \"16\"\n  }, mdx(\"path\", {\n    parentName: \"svg\",\n    \"fillRule\": \"evenodd\",\n    \"d\": \"M4 9h1v1H4c-1.5 0-3-1.69-3-3.5S2.55 3 4 3h4c1.45 0 3 1.69 3 3.5 0 1.41-.91 2.72-2 3.25V8.59c.58-.45 1-1.27 1-2.09C10 5.22 8.98 4 8 4H4c-.98 0-2 1.22-2 2.5S3 9 4 9zm9-3h-1v1h1c1 0 2 1.22 2 2.5S13.98 12 13 12H9c-.98 0-2-1.22-2-2.5 0-.83.42-1.64 1-2.09V6.25c-1.09.53-2 1.84-2 3.25C6 11.31 7.55 13 9 13h4c1.45 0 3-1.69 3-3.5S14.5 6 13 6z\"\n  }))), `Do`), mdx(\"ul\", null, mdx(\"li\", {\n    parentName: \"ul\"\n  }, `Wait until a user has moved focus away from the form field before raising an Error Message.`), mdx(\"li\", {\n    parentName: \"ul\"\n  }, `Display error messaging after a user has changed the value of a given field `, mdx(\"em\", {\n    parentName: \"li\"\n  }, `and`), ` has moved focus away from said field.`, mdx(\"ul\", {\n    parentName: \"li\"\n  }, mdx(\"li\", {\n    parentName: \"ul\"\n  }, `Raising error messages after a user has changed the value of a field prevents errors from appearing if someone is tabbing through fields to gain context of what information is needed.`), mdx(\"li\", {\n    parentName: \"ul\"\n  }, `Premature error messaging can confuse users if they already know what they need to do.`))), mdx(\"li\", {\n    parentName: \"ul\"\n  }, `Error messages are removed as individual fields are corrected.`), mdx(\"li\", {\n    parentName: \"ul\"\n  }, `Upon all individual errors being corrected, the general error message is removed.`)), mdx(\"h3\", {\n    \"id\": \"do-not-2\",\n    \"style\": {\n      \"position\": \"relative\"\n    }\n  }, mdx(\"a\", {\n    parentName: \"h3\",\n    \"href\": \"#do-not-2\",\n    \"aria-label\": \"do not 2 permalink\",\n    \"className\": \"anchor before\"\n  }, mdx(\"svg\", {\n    parentName: \"a\",\n    \"aria-hidden\": \"true\",\n    \"focusable\": \"false\",\n    \"height\": \"16\",\n    \"version\": \"1.1\",\n    \"viewBox\": \"0 0 16 16\",\n    \"width\": \"16\"\n  }, mdx(\"path\", {\n    parentName: \"svg\",\n    \"fillRule\": \"evenodd\",\n    \"d\": \"M4 9h1v1H4c-1.5 0-3-1.69-3-3.5S2.55 3 4 3h4c1.45 0 3 1.69 3 3.5 0 1.41-.91 2.72-2 3.25V8.59c.58-.45 1-1.27 1-2.09C10 5.22 8.98 4 8 4H4c-.98 0-2 1.22-2 2.5S3 9 4 9zm9-3h-1v1h1c1 0 2 1.22 2 2.5S13.98 12 13 12H9c-.98 0-2-1.22-2-2.5 0-.83.42-1.64 1-2.09V6.25c-1.09.53-2 1.84-2 3.25C6 11.31 7.55 13 9 13h4c1.45 0 3-1.69 3-3.5S14.5 6 13 6z\"\n  }))), `Do not`), mdx(\"ul\", null, mdx(\"li\", {\n    parentName: \"ul\"\n  }, `Do not raise an error message before the user has moved away from the form field. Premature error messaging can confuse users if they already know what they need to do.`), mdx(\"li\", {\n    parentName: \"ul\"\n  }, `Avoid use of dynamic validation for multiple form fields unless needed for multiple complicated form fields.`)), mdx(\"h3\", {\n    \"id\": \"accessibility-1\",\n    \"style\": {\n      \"position\": \"relative\"\n    }\n  }, mdx(\"a\", {\n    parentName: \"h3\",\n    \"href\": \"#accessibility-1\",\n    \"aria-label\": \"accessibility 1 permalink\",\n    \"className\": \"anchor before\"\n  }, mdx(\"svg\", {\n    parentName: \"a\",\n    \"aria-hidden\": \"true\",\n    \"focusable\": \"false\",\n    \"height\": \"16\",\n    \"version\": \"1.1\",\n    \"viewBox\": \"0 0 16 16\",\n    \"width\": \"16\"\n  }, mdx(\"path\", {\n    parentName: \"svg\",\n    \"fillRule\": \"evenodd\",\n    \"d\": \"M4 9h1v1H4c-1.5 0-3-1.69-3-3.5S2.55 3 4 3h4c1.45 0 3 1.69 3 3.5 0 1.41-.91 2.72-2 3.25V8.59c.58-.45 1-1.27 1-2.09C10 5.22 8.98 4 8 4H4c-.98 0-2 1.22-2 2.5S3 9 4 9zm9-3h-1v1h1c1 0 2 1.22 2 2.5S13.98 12 13 12H9c-.98 0-2-1.22-2-2.5 0-.83.42-1.64 1-2.09V6.25c-1.09.53-2 1.84-2 3.25C6 11.31 7.55 13 9 13h4c1.45 0 3-1.69 3-3.5S14.5 6 13 6z\"\n  }))), `Accessibility`), mdx(\"ul\", null, mdx(\"li\", {\n    parentName: \"ul\"\n  }, `Include an `, mdx(\"inlineCode\", {\n    parentName: \"li\"\n  }, `aria-live`), ` attribute value of \"polite\" so that the validation is presented by the screen reader after the user has completed all queued announcements.`, mdx(\"ul\", {\n    parentName: \"li\"\n  }, mdx(\"li\", {\n    parentName: \"ul\"\n  }, `For requirement criteria with dynamic hint iconography (for example, updating with \"checkmark\" or \"X\" icons as the user sets a password), images should be hidden with the `, mdx(\"inlineCode\", {\n    parentName: \"li\"\n  }, `aria-hidden`), ` attribute. Each list item should utilize `, mdx(\"inlineCode\", {\n    parentName: \"li\"\n  }, `aria-live=\"polite\"`), ` and `, mdx(\"inlineCode\", {\n    parentName: \"li\"\n  }, `aria-atomic=\"true\"`), ` attributes so the entire line of criteria gets announced when updated.`))), mdx(\"li\", {\n    parentName: \"ul\"\n  }, `If the input is invalid, we will set the `, mdx(\"inlineCode\", {\n    parentName: \"li\"\n  }, `aria-invalid`), ` attribute, add an error message directly below the input, and announce the error to the user.`), mdx(\"li\", {\n    parentName: \"ul\"\n  }, `Remove an input's associated error message once the error requirement is met.`), mdx(\"li\", {\n    parentName: \"ul\"\n  }, `Error messages should be linked to their corresponding input fields via an `, mdx(\"inlineCode\", {\n    parentName: \"li\"\n  }, `aria-describedby`), ` attribute on the input.`)));\n}\n;\nMDXContent.isMDXComponent = true;","tableOfContents":{"items":[{"url":"#anatomy-of-recommended-error-validation","title":"Anatomy of recommended error validation","items":[{"url":"#1-summary-error-heading","title":"1. Summary error heading"},{"url":"#2-summary-error-list","title":"2. Summary error list"},{"url":"#3-inline-error","title":"3. Inline error"},{"url":"#4-active-submit-button","title":"4. Active submit button"}]},{"url":"#guidance-for-all-errors","title":"Guidance for all errors","items":[{"url":"#do","title":"Do"},{"url":"#do-not","title":"Do not"}]},{"url":"#error-message-content","title":"Error message content","items":[{"url":"#all-messages-must","title":"All messages must:"},{"url":"#avoid-the-following-in-error-messages","title":"Avoid the following in error messages:"}]},{"url":"#validation-on-submit-default","title":"Validation on Submit (default)","items":[{"url":"#when-to-use","title":"When to use"},{"url":"#when-to-consider-alternatives","title":"When to consider alternatives"},{"url":"#do-1","title":"Do"},{"url":"#do-not-1","title":"Do not"},{"url":"#accessibility","title":"Accessibility"},{"url":"#screen-reader-testing","title":"Screen reader testing"},{"url":"#examples","title":"Examples"}]},{"url":"#instant-validation","title":"Instant Validation","items":[{"url":"#when-to-use-1","title":"When to use"},{"url":"#when-to-consider-alternatives-1","title":"When to consider alternatives"},{"url":"#do-2","title":"Do"},{"url":"#do-not-2","title":"Do not"},{"url":"#accessibility-1","title":"Accessibility"}]}]}}},"pageContext":{"id":"ddde24b3-4501-57fe-bbec-75fdc13698ae"}},"staticQueryHashes":["3481578012"]}